{
  "version": "0.4.6",
  "timestamp": "2026-02-13T18:44:46.683Z",
  "environment": {
    "node": "v20.19.2",
    "platform": "linux",
    "cpu": "x64"
  },
  "benchmarks": {
    "Lexer: Tokenize tiny file (~100 lines)": {
      "meanMs": 0.11312366436651453,
      "stdDevMs": 0.051120714135277044,
      "minMs": 0.10272000000031767,
      "maxMs": 1.7196769999998196,
      "ops": 8839.88337541873,
      "samples": 8840
    },
    "Lexer: Tokenize small file (~500 lines)": {
      "meanMs": 0.3262333101761243,
      "stdDevMs": 0.0988140717767527,
      "minMs": 0.29889700000012454,
      "maxMs": 1.7146379999999226,
      "ops": 3065.290909319247,
      "samples": 3066
    },
    "Lexer: Tokenize medium file (~1000 lines)": {
      "meanMs": 1.0166074837398495,
      "stdDevMs": 0.27830352579651685,
      "minMs": 0.9157100000002174,
      "maxMs": 3.8122050000001764,
      "ops": 983.663819118511,
      "samples": 984
    },
    "Lexer: Tokenize large file (~2000 lines)": {
      "meanMs": 1.3520986337837737,
      "stdDevMs": 0.16089189370452778,
      "minMs": 1.2727100000001883,
      "maxMs": 2.448369000000639,
      "ops": 739.5910143045962,
      "samples": 740
    },
    "Lexer: Tokenize xlarge file (~700 lines)": {
      "meanMs": 0.7074431413427215,
      "stdDevMs": 0.24613087910450143,
      "minMs": 0.6384859999998298,
      "maxMs": 4.895863000000645,
      "ops": 1413.5411619116244,
      "samples": 1415
    },
    "Lexer: Tokenize huge file (~5000 lines)": {
      "meanMs": 3.6180335776173504,
      "stdDevMs": 0.7071922721484094,
      "minMs": 3.1017220000003363,
      "maxMs": 8.511904999999388,
      "ops": 276.39323365775624,
      "samples": 277
    },
    "Lexer: Tokenize enormous file (~10000 lines)": {
      "meanMs": 8.93965856249993,
      "stdDevMs": 2.675466431490161,
      "minMs": 6.92750100000012,
      "maxMs": 29.049400999998397,
      "ops": 111.86109547794128,
      "samples": 112
    },
    "Parser: Parse tiny file (~100 lines)": {
      "meanMs": 0.2894896005788601,
      "stdDevMs": 0.0868670491760981,
      "minMs": 0.2608519999994314,
      "maxMs": 1.8297220000004017,
      "ops": 3454.3555208906,
      "samples": 3455
    },
    "Parser: Parse small file (~500 lines)": {
      "meanMs": 1.0002146513486425,
      "stdDevMs": 0.16411640219488358,
      "minMs": 0.9109109999990324,
      "maxMs": 3.146856999999727,
      "ops": 999.785394716671,
      "samples": 1001
    },
    "Parser: Parse medium file (~1000 lines)": {
      "meanMs": 1.535371194785255,
      "stdDevMs": 0.43734747046638456,
      "minMs": 1.2626659999987169,
      "maxMs": 4.782842999999048,
      "ops": 651.3082982124496,
      "samples": 652
    },
    "Parser: Parse large file (~2000 lines)": {
      "meanMs": 1.5303822079511002,
      "stdDevMs": 0.3282462092676075,
      "minMs": 1.3358250000001135,
      "maxMs": 4.005922000000282,
      "ops": 653.4315380853883,
      "samples": 654
    },
    "Parser: Simple table (18 fields)": {
      "meanMs": 0.058194988652232306,
      "stdDevMs": 0.03404714639584174,
      "minMs": 0.048913000000538887,
      "maxMs": 1.0448839999990014,
      "ops": 17183.610189803534,
      "samples": 17184
    },
    "Parser: Complex table (200+ fields, CalcFormulas)": {
      "meanMs": 0.32356268165642016,
      "stdDevMs": 0.0758203045679214,
      "minMs": 0.29552199999852746,
      "maxMs": 1.1297080000003916,
      "ops": 3090.5912723948336,
      "samples": 3091
    },
    "Parser: Codeunit (892 lines, 40+ procedures)": {
      "meanMs": 1.4378424885057495,
      "stdDevMs": 0.25546172708427045,
      "minMs": 1.2839569999996456,
      "maxMs": 2.9388029999990977,
      "ops": 695.4864722625015,
      "samples": 696
    },
    "Parser: Deep nesting (5-7 levels)": {
      "meanMs": 1.1547974353349462,
      "stdDevMs": 0.22230196466742527,
      "minMs": 1.037309000001187,
      "maxMs": 2.373304000000644,
      "ops": 865.9527371655033,
      "samples": 866
    },
    "Parser: Many procedures (100+ procedures)": {
      "meanMs": 1.5926990000000836,
      "stdDevMs": 0.132414642055167,
      "minMs": 1.4989129999994475,
      "maxMs": 2.341128000000026,
      "ops": 627.8650265994689,
      "samples": 628
    },
    "SymbolTable: Build from tiny AST (~50 symbols)": {
      "meanMs": 0.29594051775147173,
      "stdDevMs": 0.06225032654684403,
      "minMs": 0.2717300000003888,
      "maxMs": 0.9975440000016533,
      "ops": 3379.057411935027,
      "samples": 3380
    },
    "SymbolTable: Build from small AST (~100 symbols)": {
      "meanMs": 1.0070711722054524,
      "stdDevMs": 0.1198011524808874,
      "minMs": 0.9485920000006445,
      "maxMs": 1.6745709999995597,
      "ops": 992.9784781844497,
      "samples": 993
    },
    "SymbolTable: Build from medium AST (~200 symbols)": {
      "meanMs": 1.47877261890683,
      "stdDevMs": 0.27278806076313133,
      "minMs": 1.3251239999990503,
      "maxMs": 3.2120389999981853,
      "ops": 676.2364864040027,
      "samples": 677
    },
    "SymbolTable: Build from many procedures (~500+ symbols)": {
      "meanMs": 1.6891942804053408,
      "stdDevMs": 0.12861334872626848,
      "minMs": 1.5933059999988473,
      "maxMs": 2.4219800000028044,
      "ops": 591.9982157174005,
      "samples": 592
    },
    "SymbolTable: Case-insensitive lookup (100 lookups)": {
      "meanMs": 0.0033170924738559807,
      "stdDevMs": 0.003564576483050033,
      "minMs": 0.0031330000019806903,
      "maxMs": 0.4328989999994519,
      "ops": 301468.8338904046,
      "samples": 301469
    },
    "SymbolTable: Case-insensitive lookup (1000 lookups)": {
      "meanMs": 0.03176915661732492,
      "stdDevMs": 0.011133953177012693,
      "minMs": 0.03046100000210572,
      "maxMs": 0.6308559999997669,
      "ops": 31477.07104867437,
      "samples": 31478
    },
    "SymbolTable: Scope traversal (deep nesting)": {
      "meanMs": 1.4694436358296274,
      "stdDevMs": 0.243877387674215,
      "minMs": 1.3240549999973155,
      "maxMs": 2.401421999999002,
      "ops": 680.5296750531121,
      "samples": 681
    },
    "Integration: Lex → Parse → Symbols (tiny.cal)": {
      "meanMs": 0.29307002783475095,
      "stdDevMs": 0.0568021573367475,
      "minMs": 0.2730680000022403,
      "maxMs": 0.792725999999675,
      "ops": 3412.1537688045505,
      "samples": 3413
    },
    "Integration: Lex → Parse → Symbols (small.cal)": {
      "meanMs": 1.0169704695122015,
      "stdDevMs": 0.18756874375791008,
      "minMs": 0.9467000000004191,
      "maxMs": 3.916201000000001,
      "ops": 983.3127214398452,
      "samples": 984
    },
    "Integration: Lex → Parse → Symbols (medium.cal)": {
      "meanMs": 1.6440787914613655,
      "stdDevMs": 0.2846584674762282,
      "minMs": 1.343061999999918,
      "maxMs": 2.629295999999158,
      "ops": 608.2433549982931,
      "samples": 609
    },
    "Integration: Lex → Parse → Symbols (large.cal)": {
      "meanMs": 1.8714505420560774,
      "stdDevMs": 0.2842726507885592,
      "minMs": 1.632925999998406,
      "maxMs": 2.8286760000009963,
      "ops": 534.3448718133612,
      "samples": 535
    },
    "Integration: Lex → Parse → Symbols (xlarge.cal)": {
      "meanMs": 1.4248686695156976,
      "stdDevMs": 0.29630757974712657,
      "minMs": 1.2603850000014063,
      "maxMs": 4.860468999999284,
      "ops": 701.8190668336421,
      "samples": 702
    },
    "Integration: Lex → Parse → Symbols (xxlarge.cal)": {
      "meanMs": 1.6896358783784136,
      "stdDevMs": 0.4027224327377625,
      "minMs": 1.4563500000003842,
      "maxMs": 4.795308000000659,
      "ops": 591.8434929067234,
      "samples": 592
    },
    "Integration: Document cache (10 ops, medium.cal)": {
      "meanMs": 18.909161150943376,
      "stdDevMs": 1.0479354555079872,
      "minMs": 16.76715999999942,
      "maxMs": 22.89256000000023,
      "ops": 52.884418934158276,
      "samples": 53
    },
    "Integration: STRESS TEST (huge.cal - 5K lines)": {
      "meanMs": 4.49452769058313,
      "stdDevMs": 0.3835503982328943,
      "minMs": 4.012864000000263,
      "maxMs": 6.483163999997487,
      "ops": 222.4927887517938,
      "samples": 223
    },
    "Integration: EXTREME STRESS TEST (enormous.cal - 10K lines)": {
      "meanMs": 13.343767013333176,
      "stdDevMs": 3.881456378187594,
      "minMs": 9.458678000002692,
      "maxMs": 33.8024249999944,
      "ops": 74.94135644011124,
      "samples": 75
    },
    "SemanticTokens: Full pipeline (set-literals.cal)": {
      "meanMs": 12.839084282051772,
      "stdDevMs": 3.2618441235165023,
      "minMs": 9.692202999998699,
      "maxMs": 30.65093500000512,
      "ops": 77.88717466384551,
      "samples": 78
    }
  }
}